name,description,members,online,url
r/jobs,/r/jobs is the number one community for advice relating to your career. Head to our discord for live support: discord.gg/4nJztvj,2M,516,https://www.reddit.com/r/jobs/
r/RemoteJobs,"Remote jobs: the future of work! READ RULES BEFORE POSTING! :) This is a place to discuss remote work, share tips, and find job postings. [Community art courtesy of vecteezy.com]",273K,28,https://www.reddit.com/r/RemoteJobs/
r/DesignJobs,"Some redditors are skilled professionals, some redditors need skilled professionals. Scroll down for general information and our rules. Please read through these carefully, as breaking them is a bannable offense.",163K,32,https://www.reddit.com/r/DesignJobs/
r/AskReddit,r/AskReddit is the place to ask and answer thought-provoking questions.,55M,12K,https://www.reddit.com/r/AskReddit/
r/antiwork,"A subreddit for those who want to end work, are curious about ending work, want to get the most out of a work-free life, want more information on anti-work ideas and want personal help with their own jobs/work-related struggles.",2.9M,1.5K,https://www.reddit.com/r/antiwork/
r/torontoJobs,Redditor approved jobs in the GTHA.,61K,19,https://www.reddit.com/r/torontoJobs/
r/CanadaJobs,"This is a place to support job seekers and hiring managers. This community represents inclusivity, kindness, empathy, acceptance, and understanding for all.",23K,12,https://www.reddit.com/r/CanadaJobs/
r/recruitinghell,"Did a recruiter make you send them a resume and still fill out all the same information on their website? Did a candidate send a cover letter that just says ""PLEASE LET ME WORK HERE""? Tell us those stories!",844K,574,https://www.reddit.com/r/recruitinghell/
r/careerguidance,"A place to discuss career options, to ask questions and give advice!",4.7M,1.6K,https://www.reddit.com/r/careerguidance/
r/DubaiJobs,We all know how daunting the job hunt can be in Dubai at times. Post up any vacancies you know of over here and help the Reddit Dubai community out.,15K,16,https://www.reddit.com/r/DubaiJobs/
r/Germany_Jobs,"Do you want to work in Germany? We want to build a community for finding an english or german speaking job in germany. Find a job, post jobs or find talent. In english, german and in germany. Have questions relating your job Start in germany? Ask us!",16K,7,https://www.reddit.com/r/Germany_Jobs/
r/cscareerquestions,CSCareerQuestions is a community for those who are in the process of entering or are already part of the computer science field. Our goal is to help navigate and share challenges of the industry and strategies to be successful .,2.2M,484,https://www.reddit.com/r/cscareerquestions/
r/UKJobs,"A community intended to provide a place for users wanting to ask questions or create discussions, all related to the UK and jobs within the UK. Make sure to read the rules before posting or commenting. It is an assumption that by posting on this subreddit you already have a right to work in the UK, if not, there are better subreddits/websites for that information.",292K,149,https://www.reddit.com/r/UKJobs/
r/SideJobs,Jobs you can do outside of your normal job for extra income.,3.5K,7,https://www.reddit.com/r/SideJobs/
r/IndiaJobsOpenings,"Your go-to subreddit for finding and sharing job opportunities across India. Here, members can post job openings, career resources, internship opportunities, and offer advice related to career growth.",7K,10,https://www.reddit.com/r/IndiaJobsOpenings/
r/politics,/r/Politics is for news and discussion about U.S. politics.,8.8M,11K,https://www.reddit.com/r/politics/
r/WorkOnlineJobs,Online Jobs - Work at Home,5K,3,https://www.reddit.com/r/WorkOnlineJobs/
r/NetworkingJobs,,15K,6,https://www.reddit.com/r/NetworkingJobs/
r/memes,"Memes! A way of describing cultural information being shared. An element of a culture or system of behavior that may be considered to be passed from one individual to another by nongenetic means, especially imitation.",35M,1.6K,https://www.reddit.com/r/memes/
r/funny,Reddit's largest humor depository,67M,2.4K,https://www.reddit.com/r/funny/
r/RemoteJobsSearch,Hi everyone! This is a group where we can post Remote opportunities and we can share opinions and discuss.,1.7K,4,https://www.reddit.com/r/RemoteJobsSearch/
r/PythonJobs,Python jobs are posted here,28K,5,https://www.reddit.com/r/PythonJobs/
r/personalfinance,"Learn about budgeting, saving, getting out of debt, credit, investing, and retirement planning. Join our community, read the PF Wiki, and get on top of your finances!",21M,1.8K,https://www.reddit.com/r/personalfinance/
r/ITCareerQuestions,This subreddit is designed to help anyone in or interested in the IT field to ask career-related questions.,492K,94,https://www.reddit.com/r/ITCareerQuestions/
r/OnlineJobsPH,"💪 For Filipino Remote Workers to improve and learn new skills. ⭐ We are here to share and help Freelancers improve their chances in landing online jobs and furthering their career, to assist in any way possible. 🚀 A place to share information, tips, updates, and experiences regarding your online employment journey. Looking for work? Visit 👉 OnlineJobsPH.com 👈",4.9K,6,https://www.reddit.com/r/OnlineJobsPH/
r/CyberSecurityJobs,A forum for discussing cybersecurity career information.,41K,5,https://www.reddit.com/r/CyberSecurityJobs/
r/Showerthoughts,A subreddit for sharing those miniature epiphanies that make the mundane more amazing.,34M,539,https://www.reddit.com/r/Showerthoughts/
r/Accounting,Primarily for accountants and aspiring accountants to learn about and discuss their career choice. Advice and questions welcome.,1.1M,400,https://www.reddit.com/r/Accounting/
r/JobsPhilippines,,73K,22,https://www.reddit.com/r/JobsPhilippines/
r/DataScienceJobs,A place for people to post data science/machine learning jobs as well as those searching for jobs to put themselves in the spotlight.,32K,7,https://www.reddit.com/r/DataScienceJobs/
r/WritingPrompts,"Writing Prompts. You're a writer and you just want to flex those muscles? You've come to the right place! If you see a prompt you like, simply write a short story based on it. Get comments from others, and leave commentary for other people's works. Let's help each other.",19M,345,https://www.reddit.com/r/WritingPrompts/
r/AmItheAsshole,"A catharsis for the frustrated moral philosopher in all of us, and a place to finally find out if you were wrong in an argument that's been bothering you. Tell us about any non-violent conflict you have experienced; give us both sides of the story, and find out if you're right, or you're the asshole. See our ~~*Best Of*~~ ""Most Controversial"" at /r/AITAFiltered!",24M,8.7K,https://www.reddit.com/r/AmItheAsshole/
r/IWantOutJobs,The purpose of this subreddit is to post employment opportunities for remote work or companies that are willing to help with the relocation difficulties of moving to a new area.,16K,1,https://www.reddit.com/r/IWantOutJobs/
r/Jobs4Bitcoins,"Find Work, Find Workers! All payments done in Bitcoin and other cryptocurrencies.",69K,3,https://www.reddit.com/r/Jobs4Bitcoins/
r/pics,"A place for photographs, pictures, and other images.",32M,6.1K,https://www.reddit.com/r/pics/
r/teenagers,"r/teenagers is the biggest community forum run by teenagers for teenagers. Our subreddit is primarily for discussions and memes that an average teenager would enjoy to discuss about. We do not have any age-restriction in place but do keep in mind this is targeted for users between the ages of 13 to 19. Parents, teachers, and the like are welcomed to participate and ask any questions!",3.2M,1.5K,https://www.reddit.com/r/teenagers/
r/jobsearchhacks,"Forget traditional job searching - improve your odds with good tips, tricks and tactics that help you stand out.",238K,53,https://www.reddit.com/r/jobsearchhacks/
r/VancouverJobs,A place to match Vancouver job-seekers with Vancouver employers.,27K,10,https://www.reddit.com/r/VancouverJobs/
r/AdviceAnimals,Reddit's Gold Mine,9.9M,370,https://www.reddit.com/r/AdviceAnimals/
r/TrollXChromosomes,A subreddit for rage comics and other memes with a girly slant.,835K,34,https://www.reddit.com/r/TrollXChromosomes/
r/RemoteJobseekers,"Looking for a remote job ? We share effective strategies for finding remote jobs, inspiring stories from individuals who have successfully landed remote positions, and comprehensive guides on how to secure a remote job. Whether you're new to remote work or a seasoned professional, you'll find valuable insights to help you navigate the remote job market.",17K,4,https://www.reddit.com/r/RemoteJobseekers/
r/houstonjobs,Connecting Employers and Employees since 2011,10K,6,https://www.reddit.com/r/houstonjobs/
r/nfl,The place to discuss all NFL related things,12M,5K,https://www.reddit.com/r/nfl/
r/nursing,,1.1M,232,https://www.reddit.com/r/nursing/
r/MachineLearningJobs,"ML jobs, AI jobs, LLM jobs, machine learning, artificial intelligence, large language models like chat GPT, midjourney, etc",22K,4,https://www.reddit.com/r/MachineLearningJobs/
r/Nonprofit_Jobs,A discussion board for non-profit/charity/NGO/government/social enterprise employment.,11K,3,https://www.reddit.com/r/Nonprofit_Jobs/
r/india,The Official Subreddit for India,2.9M,883,https://www.reddit.com/r/india/
r/ffxiv,"A community for fans of the critically acclaimed MMORPG Final Fantasy XIV, with an expanded free trial that includes the entirety of A Realm Reborn and the award-winning Heavenward and Stormblood expansions up to level 70 with no restrictions on playtime. FFXIV's latest expansion, Dawntrail, is out now!",1.3M,654,https://www.reddit.com/r/ffxiv/
r/JapanJobs,Welcome to /r/JapanJobs! This is a subreddit dedicated to helping people find and post information related to working in Japan. This is a welcoming community open to all job fields and anyone looking for work or who is just curious about what is out there. More resources found on our wiki /r/JapanJobs/wiki,10K,3,https://www.reddit.com/r/JapanJobs/
r/gameDevJobs,Here you will only ever find job listings that offer compensation for your time and expertise.,14K,14,https://www.reddit.com/r/gameDevJobs/
r/mildlyinfuriating,jugkfmghgug,10M,1.7K,https://www.reddit.com/r/mildlyinfuriating/
r/legaladvice,A place to ask simple legal questions.,3M,783,https://www.reddit.com/r/legaladvice/
r/BigDataJobs,"Find and post work relating to ""Big Data"".",15K,7,https://www.reddit.com/r/BigDataJobs/
r/WebDeveloperJobs,"Jobs for JavaScript web developers who have experience with or want to learn new technologies such as: React.js, Redux, MobX, Angular 2 & 4, Vue.js, React Native, PhoneGap, Cordova, Ionic, Node.js, Express.js, GraphQL, Webpack, WebAssembly, Meteor.js, Socket.io, Babel, TypeScript, Yarn, NPM, Gulp.js, Grunt.js, WebGL. Also hiring for jobs related to: Lodash, Underscore, jQuery, Backbone.js, Ember.js, Mocha, Jasmine, Jest, Semantic UI and Bootstrap. For hire posts welcome.",15K,14,https://www.reddit.com/r/WebDeveloperJobs/
r/CasualConversation,The friendlier part of Reddit. Have a fun conversation about anything that is on your mind. Ask a question or start a conversation about (almost) anything you desire. Maybe you'll make some friends in the process.,2.6M,342,https://www.reddit.com/r/CasualConversation/
r/resumes,Get help with your resume! Checkout the wiki and/or sidebar for resources and info!,1.2M,67,https://www.reddit.com/r/resumes/
r/SFBayJobs,"SF Bay Jobs - [Hiring], [Seeking]",9.1K,1,https://www.reddit.com/r/SFBayJobs/
r/AnimalswithJobs,Post anything here related to any kind of animal with a job! Lets see the cuteness,9.2K,5,https://www.reddit.com/r/AnimalswithJobs/
r/Conservative,https://x.com/rcondiscord https://discord.gg/conservative,1.3M,2.8K,https://www.reddit.com/r/Conservative/
